{
  "schemaVersion": "1.0.0",
  "datasetFamily": "oblique-3dtiles",
  "updatedAt": "2026-03-29",
  "datasets": [
    {
      "id": "synthetic-regression-fixture",
      "scope": "deterministic-fixture",
      "description": "Small synthetic fixture used by deterministic oblique regression and unit tests.",
      "format": "3d-tiles",
      "entryFile": "test-data/oblique/fixtures/synthetic-3dtiles/tileset.json",
      "sizeBytes": 1111,
      "sha256": "41764df050a424f8924fc92acc44f45adcdbd54e31940a5858f2781a72a17a7c"
    },
    {
      "id": "cesium-discrete-lod-reference",
      "scope": "remote-reference",
      "description": "Public 3D Tiles discrete LOD sample for extended oblique compatibility checks.",
      "format": "3d-tiles",
      "url": "https://raw.githubusercontent.com/CesiumGS/3d-tiles-samples/main/1.0/TilesetWithDiscreteLOD/tileset.json",
      "downloadFile": "test-data/oblique/datasets/cesium-discrete-lod/tileset.json",
      "sizeBytes": 1640,
      "sha256": "5bb24155d89c13348d71c5e0cd2b049535f636e119b2a561312dd64506e0b796"
    }
  ]
}
